{
  "schema_version": "1.0.0",
  "context": {
    "workspace_id": "ws-demo",
    "session_id": "session-demo",
    "run_id": "run-demo",
    "document_id": "fs-demo",
    "base_document_version": "dv-7",
    "context_snapshot_id": "ctx-7",
    "template_id": "traditional-abap-five",
    "template_version": "1.0.0"
  },
  "questions": [
    {
      "issue_id": "tmp:issue-1",
      "question": "是否允许非零容差？",
      "options": [
        {
          "id": "exact",
          "label": "只允许精确匹配",
          "consequence": "非零差额保留未处理",
          "recommended": true
        },
        {
          "id": "tolerance",
          "label": "允许容差",
          "consequence": "还需确定金额、币种及差额处理",
          "recommended": false
        }
      ],
      "decision_subject_id": "rule-1",
      "decision_subject_revision": 1,
      "decision_subject_hash": "fixture-hash-rule-1"
    }
  ],
  "decision_proposals": [],
  "deferred_issue_ids": [],
  "summary": "优先确认影响方案的容差规则"
}
